{
  "$schema": "https://agent-quota.local/contracts/schemas/contract-registry-v1.schema.json",
  "$id": "https://agent-quota.local/contracts/contract-registry-v1.json",
  "schema": "aq-contract-registry-v1",
  "registry_id": "contract-registry-v1",
  "meta_schema_uri": "https://json-schema.org/draft/2020-12/schema",
  "normative_decision_inputs": [
    {
      "path": "docs/audits/gui-product-decision-resolution.md",
      "category": "non-history-normative-decision-input",
      "record_kind": "normative-product-decision-non-history",
      "decision_status": "confirmed-current-pending-independent-r20",
      "history_membership": "forbidden-not-audit-not-resolution",
      "first_line": "# GUI 产品决策处置记录（非审计轮次）",
      "projection_marker": "AQ-NORMATIVE-PRODUCT-DECISION-V1",
      "raw_sha256": "fc3bdd90d8e5d66bd2b969b08e6f3c8d80f95e6a24702eb1a4c7fb5850cd559a"
    }
  ],
  "array_order_dialect": {
    "dialect": "aq-array-order-v1",
    "version": 1,
    "meta_schema_uri": "https://agent-quota.local/contracts/schemas/contract-registry-v1.schema.json#/$defs/arrayOrderMetadata",
    "default_policy": "sequence_exact",
    "override_policy": "utf8_key"
  },
  "canonicalizer": {
    "implementation_path": "docs/contracts/canonicalize-registry-v1.py",
    "implementation_version": "aq-canonicalizer-v1",
    "validator_path": "docs/contracts/validate-contracts-v1.py",
    "validator_version": "aq-contract-validator-v1",
    "execution_mode": "read-only-verifier",
    "trust_status": "audit-evidence-only-not-a-release-authority",
    "production_authority": "externally-pinned-signed-release-or-vcs-commit-plus-tool-raw-sha256-and-prior-root-authorization",
    "self_pin_update": "forbidden",
    "input_paths": [
      "docs/contracts/core-safety-contract-v1.json",
      "docs/contracts/fixtures/core-safety-v1.json",
      "docs/contracts/fixtures/retention-lint-malicious-v1.json",
      "docs/contracts/lease-policy-v1.json",
      "docs/contracts/local-key-purpose-registry-v1.json",
      "docs/contracts/operation-contract-v1.json",
      "docs/contracts/retention-lint-v1.json",
      "docs/contracts/schemas/contract-registry-v1.schema.json",
      "docs/contracts/schemas/core-safety-contract-v1.schema.json",
      "docs/contracts/schemas/lease-policy-v1.schema.json",
      "docs/contracts/schemas/local-key-purpose-registry-v1.schema.json",
      "docs/contracts/schemas/operation-contract-v1.schema.json",
      "docs/contracts/schemas/retention-lint-v1.schema.json"
    ],
    "registry_anchor_recipe": "SHA256(ASCII('agent-quota:contract-registry:v1\\x00')||aq-jcs-nfc-v1(registry-with-current-pins))"
  },
  "digest_recipes": {
    "artifact_canonical": "SHA256(ASCII('agent-quota:contract-artifact:v1\\x00')||aq-jcs-nfc-v1(document))",
    "schema_canonical": "SHA256(ASCII('agent-quota:contract-schema:v1\\x00')||aq-jcs-nfc-v1(schema_document))",
    "raw": "SHA256(raw_bytes)"
  },
  "raw_bounds": {
    "registry_raw_bytes_max": 65536,
    "artifact_raw_bytes_max": 524288,
    "schema_raw_bytes_max": 262144,
    "json_depth_max": 64,
    "json_nodes_max": 100000,
    "string_utf8_bytes_max": 16384,
    "array_items_max": 4096,
    "integer_min": -9223372036854775808,
    "integer_max": 9223372036854775807,
    "floats": "reject",
    "non_finite_numbers": "reject",
    "duplicate_keys": "reject_before_schema"
  },
  "path_resolution": {
    "fixed_root": "repository-root-opened-once-as-directory-handle",
    "segment_validation": "ASCII-lowercase-contract-path-components-with-no-dot-dot-empty-or-separator-encoding",
    "decode_or_normalize": "forbidden",
    "open_algorithm": "openat-each-component-relative-to-fixed-root",
    "symlink_policy": "O_NOFOLLOW-every-component",
    "final_identity_check": "resolved-relative-path-bytes-must-equal-registered-path-bytes"
  },
  "validation_order": [
    "registry_raw_bounds",
    "utf8_decode_and_nfc",
    "strict_json_parse",
    "registry_schema_hash",
    "registry_schema_validate",
    "artifact_raw_bounds",
    "artifact_raw_hash",
    "schema_raw_bounds",
    "schema_raw_and_canonical_hash",
    "schema_meta_validate",
    "artifact_schema_validate",
    "semantic_closure_validate"
  ],
  "schema_binding": {
    "schema_path": "docs/contracts/schemas/contract-registry-v1.schema.json",
    "schema_uri": "https://agent-quota.local/contracts/schemas/contract-registry-v1.schema.json",
    "schema_raw_sha256": "42de9280df16f7a209889160f353650465c2b58dcc285709177e0186dc26fb30",
    "schema_canonical_sha256": "17925bb7dbd17db5a0e5d6eef754df9bcdbce40bcdcd3af31c84e1cd7e9cf07f"
  },
  "artifacts": [
    {
      "artifact_id": "core-safety-contract-v1",
      "artifact_path": "docs/contracts/core-safety-contract-v1.json",
      "artifact_schema_uri": "https://agent-quota.local/contracts/schemas/core-safety-contract-v1.schema.json",
      "artifact_raw_sha256": "09c44fb16d465380943c307a8de9072f0f6c1b14030ecc09c8f1007009ad336e",
      "artifact_canonical_sha256": "db91b4d1b677df75f77875e47b71179644f53a33219e3df31cd29f22e32ca942",
      "schema_path": "docs/contracts/schemas/core-safety-contract-v1.schema.json",
      "schema_raw_sha256": "13b339ed55c47a0d5ad52590f24dfef467115abf4ddc4013a9d36a498560b89a",
      "schema_canonical_sha256": "355b3fbac1329a719eda3c6520ffc6ebd14252024fac48e47ef0884df1c36f4d"
    },
    {
      "artifact_id": "lease-policy-v1",
      "artifact_path": "docs/contracts/lease-policy-v1.json",
      "artifact_schema_uri": "https://agent-quota.local/contracts/schemas/lease-policy-v1.schema.json",
      "artifact_raw_sha256": "278235f52038a292c12a1d7201295c242e14a83fa2aa8850df255a8929355893",
      "artifact_canonical_sha256": "e35025270a95404bf7d916d42efe48081681e532fa4a8f1e0c8c331c5ff0934b",
      "schema_path": "docs/contracts/schemas/lease-policy-v1.schema.json",
      "schema_raw_sha256": "7ceb6a06ba78bd04538391555d342e524923d13939d4c2cda68e11a3287c6b12",
      "schema_canonical_sha256": "e60d13e252181a4fbe82041f01260ddd2df6bf5bf1c06ada21220ffdd12135e6"
    },
    {
      "artifact_id": "local-key-purpose-registry-v1",
      "artifact_path": "docs/contracts/local-key-purpose-registry-v1.json",
      "artifact_schema_uri": "https://agent-quota.local/contracts/schemas/local-key-purpose-registry-v1.schema.json",
      "artifact_raw_sha256": "1a46c58ba2550a9a32af37a5b97b180b3e8e9e171d511e8da42cec4211ce2f6d",
      "artifact_canonical_sha256": "3f2a2b8cb11f918c9a7ba11d7e8cb527f94beec7e80ee8d90418b868aa843c0d",
      "schema_path": "docs/contracts/schemas/local-key-purpose-registry-v1.schema.json",
      "schema_raw_sha256": "9d9f71c8532c376c0fd7c49c66390e97dd487e4bc05392e99c1ce3666a3e0e0a",
      "schema_canonical_sha256": "20d9922376a2d9323fd5a1774bde46d403a7a34569f9e0e5c2db2799a1ec6bcc"
    },
    {
      "artifact_id": "operation-contract-v1",
      "artifact_path": "docs/contracts/operation-contract-v1.json",
      "artifact_schema_uri": "https://agent-quota.local/contracts/schemas/operation-contract-v1.schema.json",
      "artifact_raw_sha256": "993b9adda60647c74181cae18e40824f5216959c850a061d217ca5d09219e166",
      "artifact_canonical_sha256": "7b3af5ce70cc09cbff7c405c8129856526b8a32f389dcc93af892125160ecc10",
      "schema_path": "docs/contracts/schemas/operation-contract-v1.schema.json",
      "schema_raw_sha256": "481af8b9617c213d5292f89952f8fa6fca40dec6717ea746d4b9c1fa4bd6156e",
      "schema_canonical_sha256": "74c800084df03e4ce5219ae58bdb199903353a21b3c18846e99c411f0546d314"
    },
    {
      "artifact_id": "retention-lint-v1",
      "artifact_path": "docs/contracts/retention-lint-v1.json",
      "artifact_schema_uri": "https://agent-quota.local/contracts/schemas/retention-lint-v1.schema.json",
      "artifact_raw_sha256": "d0325e96a3aff8e9ed383ffd876b5b2e0042ee42568c6c6bf7c99eb993807403",
      "artifact_canonical_sha256": "bf3804de286cb2bee86e24e2a274dfb9eba98995ac074d87d98fd6995b9ad342",
      "schema_path": "docs/contracts/schemas/retention-lint-v1.schema.json",
      "schema_raw_sha256": "f583e9c82cfee4d1bb0c63eb0104b4cba9730adec7c639d12ea48f913a00053c",
      "schema_canonical_sha256": "5f1b91ccc66a14209d5f30c4f30abb93c272f97686b8b9ff53afe70f60161df8"
    }
  ],
  "fixtures": [
    {
      "fixture_id": "core-safety-v1",
      "fixture_path": "docs/contracts/fixtures/core-safety-v1.json",
      "schema_uri": "https://agent-quota.local/contracts/schemas/core-safety-contract-v1.schema.json#/$defs/fixtureArtifact",
      "raw_sha256": "2a7e13c56be0335b48f52035317102fd74335ed33196283b0a682cc8223a533d",
      "canonical_sha256": "424e7a917893687a959c55aa0e83785267db7fcc14b6de491f83a195fe64a73c"
    },
    {
      "fixture_id": "retention-lint-malicious-v1",
      "fixture_path": "docs/contracts/fixtures/retention-lint-malicious-v1.json",
      "schema_uri": "https://agent-quota.local/contracts/schemas/retention-lint-v1.schema.json#/$defs/fixtureArtifact",
      "raw_sha256": "6d81644c5c9dff88be561bb394054c85dc16e3ec51ea84a4b5c48ac2e0a41048",
      "canonical_sha256": "7aca55a7ad81b761bec9e772988a97af732cfdcb7af25dda0fbdb63ccfdb7634"
    }
  ],
  "semantic_validators": [
    {
      "validator_id": "array-order-dialect-v1",
      "applies_to": "all",
      "rule": "Every schema uses exactly aq-array-order-v1 and its metadata validates against the registered arrayOrderMetadata fragment; no legacy field spelling is accepted.",
      "verdict": "reject"
    },
    {
      "validator_id": "core-safety-closure-v1",
      "applies_to": "core-safety-contract-v1",
      "rule": "Codex bundle roots, identity bootstrap, budget groups, migration membership, installation registry and repository path fixtures close exactly and all expected verdicts match.",
      "verdict": "reject"
    },
    {
      "validator_id": "core-safety-fixture-runner-v1",
      "applies_to": "core-safety-contract-v1",